[
    {
        "_id": 3,
        "code": "TABLE-B",
        "name": "Table B",
        "description": "",
        "_class": "TABLE",
        "position": {
            "x": 300,
            "y": 0,
            "z": 0
        },
        "size": {
            "w": 222,
            "h": 333
        }
    },
    {
        "_id": 2,
        "code": "TABLE-A",
        "name": "Table A",
        "description": "",
        "_class": "TABLE",
        "position": {
            "x": -300,
            "y": 0,
            "z": 0
        },
        "size": {
            "w": 222,
            "h": 333
        }
    }
]
